{
  "schema_version": "baton.packet/v1",
  "id": "demo-packet-001",
  "title": "Implement BTN001 lint rule",
  "status": "draft",
  "validation_level": "draft",
  "task_type": "implementation",
  "objective": "Wire BTN001 into the lint engine.",
  "current_state": "Rule scaffold exists but is not registered.",
  "next_action": "Register the rule in packages/lint/rules/index.ts.",
  "open_questions": [],
  "confidence_score": 0.7,
  "repo_context": {
    "attached": true,
    "root": "/repo/baton",
    "vcs": "git",
    "branch": "feat/btn001",
    "base_branch": "main",
    "commit": "abc1234",
    "base_commit": "def5678",
    "dirty": false
  },
  "context_items": [],
  "constraints": [],
  "attempts": [],
  "acceptance_criteria": [],
  "warnings": [],
  "provenance_links": [],
  "source_artifacts": [],
  "created_at": "2026-04-27T00:00:00Z",
  "updated_at": "2026-04-27T00:00:00Z"
}
