{
  "schema_version": "baton.packet/v1",
  "id": "demo-packet",
  "title": "Demo packet",
  "status": "draft",
  "validation_level": "draft",
  "task_type": "generic",
  "objective": "Do the thing.",
  "current_state": "Nothing has happened yet.",
  "next_action": "Start.",
  "open_questions": [],
  "confidence_score": 0.5,
  "repo_context": {
    "attached": true,
    "root": "/repo",
    "vcs": "git",
    "branch": "main",
    "base_branch": "main",
    "commit": "abc1234",
    "base_commit": "def5678",
    "dirty": false
  },
  "context_items": [
    {
      "kind": "file",
      "ref": "src/critical.ts",
      "reason": "load-bearing module",
      "priority": 5,
      "freshness_score": 1,
      "provenance_refs": ["prov-1"]
    }
  ],
  "constraints": [],
  "attempts": [],
  "acceptance_criteria": [],
  "warnings": [],
  "provenance_links": [],
  "source_artifacts": [],
  "created_at": "2026-04-27T00:00:00Z",
  "updated_at": "2026-04-27T00:00:00Z"
}
