{
  "schema_version": "baton.packet/v1",
  "id": "demo-packet",
  "title": "Demo packet",
  "status": "awaiting_approval",
  "validation_level": "ready",
  "task_type": "generic",
  "objective": "Do the thing.",
  "current_state": "Awaiting approval.",
  "next_action": "Wait for human.",
  "open_questions": [],
  "confidence_score": 0.9,
  "repo_context": {
    "attached": true,
    "root": "/repo",
    "vcs": "git",
    "branch": "main",
    "base_branch": "main",
    "commit": "abc1234",
    "base_commit": "def5678",
    "dirty": false
  },
  "context_items": [],
  "constraints": [],
  "attempts": [],
  "acceptance_criteria": [],
  "warnings": [],
  "provenance_links": [],
  "source_artifacts": [],
  "policy": {
    "approval_required": true,
    "dispatch_allowed": true,
    "stale_context": false,
    "reasons": []
  },
  "created_at": "2026-04-27T00:00:00Z",
  "updated_at": "2026-04-27T00:00:00Z"
}
