{
  "schema_version": "baton.packet/v1",
  "id": "demo-packet",
  "title": "Demo packet",
  "status": "draft",
  "validation_level": "draft",
  "task_type": "generic",
  "objective": "Do the thing.",
  "current_state": "Tried once.",
  "next_action": "Try again.",
  "open_questions": [],
  "confidence_score": 0.5,
  "repo_context": {
    "attached": true,
    "root": "/repo",
    "vcs": "git",
    "branch": "main",
    "base_branch": "main",
    "commit": "abc1234",
    "base_commit": "def5678",
    "dirty": false
  },
  "context_items": [],
  "constraints": [],
  "attempts": [
    {
      "id": "attempt-1",
      "tool": "claude-code",
      "summary": "Tried implementing X.",
      "result": "failed",
      "failure_reason": "Tests broke.",
      "artifact_refs": ["log-1"],
      "created_at": "2026-04-27T00:00:00Z"
    }
  ],
  "acceptance_criteria": [],
  "warnings": [],
  "provenance_links": [],
  "source_artifacts": [],
  "created_at": "2026-04-27T00:00:00Z",
  "updated_at": "2026-04-27T00:00:00Z"
}
